{
  "schema_version": "ghostark.research.human_review_queue_item.v1",
  "queue_item_id": "hrq_fixture_escalation_001",
  "created_at": "2026-07-09T14:00:00.000Z",
  "status": "in_review",
  "priority": "critical",
  "trigger": {
    "type": "receipt_verification_failure",
    "observation_id": null,
    "observation_digest": null,
    "reason_codes": ["signature_verdict_failed"]
  },
  "receipt_references": [
    {
      "receipt_id": "rct_292264b449c853481a45c4df9ceff87641f53cf0fc982dc013987f9ab696ba15",
      "receipt_digest": "sha256:67bad9140ee958eda4639cefe7a3ef84645a748db1005e6a40bf3368aa94c812"
    }
  ],
  "evidence_references": [
    {
      "artifact_type": "verifier_report",
      "artifact_id": "verifier_report_fixture_failed_001",
      "artifact_digest": "sha256:aaaaaaaaaaaaaaaaaaaaaaaaaaaaaaaaaaaaaaaaaaaaaaaaaaaaaaaaaaaaaaaa"
    }
  ],
  "assignment": {
    "reviewer_role": "security_reviewer",
    "reviewer_id_hash": "hmac-sha256:9999999999999999999999999999999999999999999999999999999999999999",
    "review_due_at": "2026-07-09T15:00:00.000Z"
  },
  "privacy": {
    "raw_content_included": false,
    "notes_storage": "digest_only",
    "redaction_policy_digest": "sha256:eeeeeeeeeeeeeeeeeeeeeeeeeeeeeeeeeeeeeeeeeeeeeeeeeeeeeeeeeeeeeeee"
  },
  "audit": {
    "event_id": "audit_escalated_queue_001",
    "event_digest": "sha256:bbbbbbbbbbbbbbbbbbbbbbbbbbbbbbbbbbbbbbbbbbbbbbbbbbbbbbbbbbbbbbbb",
    "previous_event_digest": null
  },
  "non_claims": [
    "This fixture declares a failed verifier report reference without proving the report or receipt is authentic.",
    "Queue priority is a recorded routing value, not a complete impact assessment."
  ]
}
